商品番号,JANコード,商品名,価格,在庫数,カラー,サイズ,重量,送料区分,梱包サイズ,商品説明,特徴,素材,耐荷重,付属品,注意事項,保証期間,組立時間,組立人数,関連商品,取扱説明書PDF,組立動画URL,使用動画URL,商品画像
MTR-100,4901234567890,スチール製 頑丈ラック 5段,12800,45,マットブラック,W900×D450×H1800mm,18.5kg,中型便,W950×D500×H150mm,倉庫や店舗の整理に最適な高耐荷重スチールラック。棚板の位置は調整可能。,・ボルトレスで簡単組立\n・1段あたり耐荷重150kgの頑丈設計\n・サビに強い粉体塗装仕上げ,スチール（紛体塗装）・MDF棚板,棚板1枚あたり：150kg（全体：750kg）,支柱×4棚板×5補強バー×10ゴム脚×4ゴムハンマー×1,・平らな場所に設置してください。\n・必ず耐荷重の範囲内でご使用ください。\n・組立時は軍手を着用してください。,1年間,20分,1人,"CHR-305,BOX-501",https://example.com/manuals/mtr-100.pdf,https://www.youtube.com/embed/dQw4w9WgXcQ,https://www.youtube.com/embed/dQw4w9WgXcQ,images/mtr100.png
DSK-202,4901234567891,エルゴノミクス 電動昇降デスク,49800,12,オーク＆ホワイト,W1200×D600×H700-1150mm,28kg,大型便,W1250×D650×H220mm,体型や姿勢に合わせて高さを自在に調整できる電動昇降デスク。静音モーター搭載。,・メモリー機能付きコントローラー\n・衝突検知センサーによる自動停止機能\n・頑丈なスチール製フレーム,天板：メラミン化粧板・フレーム：スチール,60kg,昇降デスク本体×1電源ケーブル×1組立用ネジ一式六角レンチ×1,・昇降動作中は周囲に障害物がないか確認してください。\n・過荷重状態で昇降させないでください。,2年間,40分,2人,"MTR-100,CHR-305",https://example.com/manuals/dsk-202.pdf,https://www.youtube.com/embed/dQw4w9WgXcQ,https://www.youtube.com/embed/dQw4w9WgXcQ,images/dsk202.png
CHR-305,4901234567892,高通気性 メッシュオフィスチェア,18800,28,グレー＆ホワイト,W650×D650×H1150-1250mm,14kg,中型便,W700×D680×H380mm,長時間のデスクワークでも蒸れにくい高弾性メッシュ素材を採用したオフィスチェア。,・可動式ヘッドレスト＆アームレスト\n・シンクロロッキング機能搭載\n・ランバーサポート（腰当て）位置調整可能,ポリエステルメッシュ・ナイロン樹脂ベース・ウレタンキャスター,120kg,チェア本体パーツ一式ガスシリンダー×1キャスター×5組立工具×1,・フローリングで使用する際は椅子の下にカーペット等を敷くことをお勧めします。,1年間,25分,1人,"DSK-202,LMP-408",https://example.com/manuals/chr-305.pdf,https://www.youtube.com/embed/dQw4w9WgXcQ,https://www.youtube.com/embed/dQw4w9WgXcQ,images/chr305.png
LMP-408,4901234567893,高演色 LED クランプライト,6980,15,ホワイト,W350×D200×H450mm,1.2kg,小物便,W400×D250×H100mm,自然光に近い演色性（Ra95）を実現し、デスク作業や読書に最適なクランプ式アームライト。,・5段階調光＆3色調色機能付き\n・アーム角度を自在に調節可能\n・机を広く使えるクランプ固定式,アルミ・ABS樹脂,-,LEDライト本体×1ACアダプター×1クランプ金具×1取扱説明書,-,1年間,5分,1人,"DSK-202,CHR-305",https://example.com/manuals/lmp-408.pdf,,https://www.youtube.com/embed/dQw4w9WgXcQ,images/lmp408.png
BOX-501,4901234567894,キャスター付き 大容量収納ボックス,3980,85,クリアブラック,W400×D700×H350mm,2.8kg,中型便,W410×D710×H360mm,衣類や備品の整理に便利な大容量スタッキングボックス。キャスター付きで移動もラクラク。,・半透明で中身が見えやすい\n・スタッキング（積み重ね）対応\n・移動に便利なキャスター付き,ポリプロピレン,天板荷重：10kg（積み重ね最大3段まで）,収納ボックス本体×1フタ×1キャスター×4,・耐荷重を超える荷重をかけないでください。\n・積み重ねの際はバランスに注意してください。,初期不良のみ,なし,1人,"MTR-100",https://example.com/manuals/box-501.pdf,,https://www.youtube.com/embed/dQw4w9WgXcQ,images/box501.png
